{
  "schema_version": "1.0.0",
  "slug": "steam-top-played",
  "generated_at": "2026-09-23T00:37:23Z",
  "as_of": "2026-09-23T00:37:23Z",
  "period": {
    "label": "live"
  },
  "metric": {
    "id": "ccu",
    "unit": "players"
  },
  "items": [
    {
      "rank": 1,
      "id": "730",
      "name": "Counter-Strike 2",
      "value": 407333,
      "unit": "players",
      "meta": {
        "peak_in_game": 1236411,
        "appid": 730
      }
    },
    {
      "rank": 2,
      "id": "570",
      "name": "Dota 2",
      "value": 329055,
      "unit": "players",
      "meta": {
        "peak_in_game": 824642,
        "appid": 570
      }
    },
    {
      "rank": 3,
      "id": "1867240",
      "name": "WARDOGS",
      "value": 240557,
      "unit": "players",
      "meta": {
        "peak_in_game": 302873,
        "appid": 1867240
      }
    },
    {
      "rank": 4,
      "id": "892970",
      "name": "Valheim",
      "value": 141947,
      "unit": "players",
      "meta": {
        "peak_in_game": 213162,
        "appid": 892970
      }
    },
    {
      "rank": 5,
      "id": "2676230",
      "name": "FiveM",
      "value": 133930,
      "unit": "players",
      "meta": {
        "peak_in_game": 187753,
        "appid": 2676230
      }
    },
    {
      "rank": 6,
      "id": "3419430",
      "name": "Bongo Cat",
      "value": 117099,
      "unit": "players",
      "meta": {
        "peak_in_game": 169812,
        "appid": 3419430
      }
    },
    {
      "rank": 7,
      "id": "2767030",
      "name": "Marvel Rivals",
      "value": 87114,
      "unit": "players",
      "meta": {
        "peak_in_game": 93014,
        "appid": 2767030
      }
    },
    {
      "rank": 8,
      "id": "359550",
      "name": "Tom Clancy's Rainbow Six Siege",
      "value": 78381,
      "unit": "players",
      "meta": {
        "peak_in_game": 80046,
        "appid": 359550
      }
    },
    {
      "rank": 9,
      "id": "553850",
      "name": "HELLDIVERS™ 2",
      "value": 66566,
      "unit": "players",
      "meta": {
        "peak_in_game": 92344,
        "appid": 553850
      }
    },
    {
      "rank": 10,
      "id": "1172470",
      "name": "Apex Legends™",
      "value": 65667,
      "unit": "players",
      "meta": {
        "peak_in_game": 262884,
        "appid": 1172470
      }
    },
    {
      "rank": 11,
      "id": "1422450",
      "name": "Deadlock",
      "value": 64957,
      "unit": "players",
      "meta": {
        "peak_in_game": 72432,
        "appid": 1422450
      }
    },
    {
      "rank": 12,
      "id": "2357570",
      "name": "Overwatch®",
      "value": 63606,
      "unit": "players",
      "meta": {
        "peak_in_game": 69982,
        "appid": 2357570
      }
    },
    {
      "rank": 13,
      "id": "3678970",
      "name": "TBH: Task Bar Hero",
      "value": 63580,
      "unit": "players",
      "meta": {
        "peak_in_game": 90751,
        "appid": 3678970
      }
    },
    {
      "rank": 14,
      "id": "252490",
      "name": "Rust",
      "value": 55802,
      "unit": "players",
      "meta": {
        "peak_in_game": 103118,
        "appid": 252490
      }
    },
    {
      "rank": 15,
      "id": "440",
      "name": "Team Fortress 2",
      "value": 53855,
      "unit": "players",
      "meta": {
        "peak_in_game": 71144,
        "appid": 440
      }
    },
    {
      "rank": 16,
      "id": "1623730",
      "name": "Palworld",
      "value": 48847,
      "unit": "players",
      "meta": {
        "peak_in_game": 75230,
        "appid": 1623730
      }
    },
    {
      "rank": 17,
      "id": "2868840",
      "name": "Slay the Spire 2",
      "value": 47015,
      "unit": "players",
      "meta": {
        "peak_in_game": 95274,
        "appid": 2868840
      }
    },
    {
      "rank": 18,
      "id": "431960",
      "name": "Wallpaper Engine",
      "value": 46499,
      "unit": "players",
      "meta": {
        "peak_in_game": 102894,
        "appid": 431960
      }
    },
    {
      "rank": 19,
      "id": "108600",
      "name": "Project Zomboid",
      "value": 45250,
      "unit": "players",
      "meta": {
        "peak_in_game": 54701,
        "appid": 108600
      }
    },
    {
      "rank": 20,
      "id": "1086940",
      "name": "Baldur's Gate 3",
      "value": 43582,
      "unit": "players",
      "meta": {
        "peak_in_game": 55983,
        "appid": 1086940
      }
    },
    {
      "rank": 21,
      "id": "381210",
      "name": "Dead by Daylight",
      "value": 43271,
      "unit": "players",
      "meta": {
        "peak_in_game": 61530,
        "appid": 381210
      }
    },
    {
      "rank": 22,
      "id": "230410",
      "name": "Warframe",
      "value": 41381,
      "unit": "players",
      "meta": {
        "peak_in_game": 61510,
        "appid": 230410
      }
    },
    {
      "rank": 23,
      "id": "322170",
      "name": "Geometry Dash",
      "value": 38853,
      "unit": "players",
      "meta": {
        "peak_in_game": 47465,
        "appid": 322170
      }
    },
    {
      "rank": 24,
      "id": "4891320",
      "name": "[WoG] War of Genesis: Idle Loot",
      "value": 38565,
      "unit": "players",
      "meta": {
        "peak_in_game": 48205,
        "appid": 4891320
      }
    },
    {
      "rank": 25,
      "id": "413150",
      "name": "Stardew Valley",
      "value": 36124,
      "unit": "players",
      "meta": {
        "peak_in_game": 74198,
        "appid": 413150
      }
    },
    {
      "rank": 26,
      "id": "250900",
      "name": "The Binding of Isaac: Rebirth",
      "value": 35999,
      "unit": "players",
      "meta": {
        "peak_in_game": 76678,
        "appid": 250900
      }
    },
    {
      "rank": 27,
      "id": "578080",
      "name": "PUBG: BATTLEGROUNDS",
      "value": 35196,
      "unit": "players",
      "meta": {
        "peak_in_game": 747912,
        "appid": 578080
      }
    },
    {
      "rank": 28,
      "id": "438100",
      "name": "VRChat",
      "value": 34697,
      "unit": "players",
      "meta": {
        "peak_in_game": 53828,
        "appid": 438100
      }
    },
    {
      "rank": 29,
      "id": "3405690",
      "name": "EA SPORTS FC™ 26",
      "value": 33984,
      "unit": "players",
      "meta": {
        "peak_in_game": 46672,
        "appid": 3405690
      }
    },
    {
      "rank": 30,
      "id": "1938090",
      "name": "Call of Duty®",
      "value": 31109,
      "unit": "players",
      "meta": {
        "peak_in_game": 33376,
        "appid": 1938090
      }
    }
  ],
  "source_fetched": [
    {
      "name": "Steam Web API",
      "url": "https://api.steampowered.com/ISteamChartsService/GetGamesByConcurrentPlayers/v1/",
      "fetched_at": "2026-09-23T00:37:23Z",
      "http_status": 200
    }
  ],
  "notes": "steam last_update=1790123616"
}
