{
  "schema_version": "1.0.0",
  "slug": "steam-top-played",
  "generated_at": "2026-09-26T01:36:39Z",
  "as_of": "2026-09-26T01:36:39Z",
  "period": {
    "label": "live"
  },
  "metric": {
    "id": "ccu",
    "unit": "players"
  },
  "items": [
    {
      "rank": 1,
      "id": "730",
      "name": "730",
      "value": 542924,
      "unit": "players",
      "meta": {
        "peak_in_game": 1308112,
        "appid": 730
      }
    },
    {
      "rank": 2,
      "id": "570",
      "name": "570",
      "value": 380441,
      "unit": "players",
      "meta": {
        "peak_in_game": 842846,
        "appid": 570
      }
    },
    {
      "rank": 3,
      "id": "1867240",
      "name": "1867240",
      "value": 236636,
      "unit": "players",
      "meta": {
        "peak_in_game": 290491,
        "appid": 1867240
      }
    },
    {
      "rank": 4,
      "id": "3419430",
      "name": "3419430",
      "value": 148814,
      "unit": "players",
      "meta": {
        "peak_in_game": 178997,
        "appid": 3419430
      }
    },
    {
      "rank": 5,
      "id": "892970",
      "name": "892970",
      "value": 145247,
      "unit": "players",
      "meta": {
        "peak_in_game": 205141,
        "appid": 892970
      }
    },
    {
      "rank": 6,
      "id": "2676230",
      "name": "FiveM",
      "value": 135350,
      "unit": "players",
      "meta": {
        "peak_in_game": 182877,
        "appid": 2676230
      }
    },
    {
      "rank": 7,
      "id": "578080",
      "name": "578080",
      "value": 124496,
      "unit": "players",
      "meta": {
        "peak_in_game": 652161,
        "appid": 578080
      }
    },
    {
      "rank": 8,
      "id": "4126040",
      "name": "Aniimo",
      "value": 102994,
      "unit": "players",
      "meta": {
        "peak_in_game": 143345,
        "appid": 4126040
      }
    },
    {
      "rank": 9,
      "id": "2767030",
      "name": "2767030",
      "value": 89806,
      "unit": "players",
      "meta": {
        "peak_in_game": 89947,
        "appid": 2767030
      }
    },
    {
      "rank": 10,
      "id": "359550",
      "name": "359550",
      "value": 79507,
      "unit": "players",
      "meta": {
        "peak_in_game": 82861,
        "appid": 359550
      }
    },
    {
      "rank": 11,
      "id": "1172470",
      "name": "1172470",
      "value": 71760,
      "unit": "players",
      "meta": {
        "peak_in_game": 231481,
        "appid": 1172470
      }
    },
    {
      "rank": 12,
      "id": "2357570",
      "name": "2357570",
      "value": 69919,
      "unit": "players",
      "meta": {
        "peak_in_game": 72167,
        "appid": 2357570
      }
    },
    {
      "rank": 13,
      "id": "3678970",
      "name": "3678970",
      "value": 67743,
      "unit": "players",
      "meta": {
        "peak_in_game": 85589,
        "appid": 3678970
      }
    },
    {
      "rank": 14,
      "id": "230410",
      "name": "230410",
      "value": 66600,
      "unit": "players",
      "meta": {
        "peak_in_game": 84979,
        "appid": 230410
      }
    },
    {
      "rank": 15,
      "id": "1422450",
      "name": "Deadlock",
      "value": 66547,
      "unit": "players",
      "meta": {
        "peak_in_game": 75715,
        "appid": 1422450
      }
    },
    {
      "rank": 16,
      "id": "252490",
      "name": "252490",
      "value": 66051,
      "unit": "players",
      "meta": {
        "peak_in_game": 124585,
        "appid": 252490
      }
    },
    {
      "rank": 17,
      "id": "1142710",
      "name": "1142710",
      "value": 58564,
      "unit": "players",
      "meta": {
        "peak_in_game": 88490,
        "appid": 1142710
      }
    },
    {
      "rank": 18,
      "id": "440",
      "name": "440",
      "value": 57627,
      "unit": "players",
      "meta": {
        "peak_in_game": 76562,
        "appid": 440
      }
    },
    {
      "rank": 19,
      "id": "553850",
      "name": "HELLDIVERS™ 2",
      "value": 56435,
      "unit": "players",
      "meta": {
        "peak_in_game": 61074,
        "appid": 553850
      }
    },
    {
      "rank": 20,
      "id": "431960",
      "name": "431960",
      "value": 55013,
      "unit": "players",
      "meta": {
        "peak_in_game": 111039,
        "appid": 431960
      }
    },
    {
      "rank": 21,
      "id": "2868840",
      "name": "Slay the Spire 2",
      "value": 53148,
      "unit": "players",
      "meta": {
        "peak_in_game": 93313,
        "appid": 2868840
      }
    },
    {
      "rank": 22,
      "id": "1623730",
      "name": "1623730",
      "value": 51428,
      "unit": "players",
      "meta": {
        "peak_in_game": 68306,
        "appid": 1623730
      }
    },
    {
      "rank": 23,
      "id": "438100",
      "name": "438100",
      "value": 48198,
      "unit": "players",
      "meta": {
        "peak_in_game": 56850,
        "appid": 438100
      }
    },
    {
      "rank": 24,
      "id": "108600",
      "name": "Project Zomboid",
      "value": 47318,
      "unit": "players",
      "meta": {
        "peak_in_game": 54701,
        "appid": 108600
      }
    },
    {
      "rank": 25,
      "id": "4080220",
      "name": "4080220",
      "value": 45572,
      "unit": "players",
      "meta": {
        "peak_in_game": 91542,
        "appid": 4080220
      }
    },
    {
      "rank": 26,
      "id": "1086940",
      "name": "1086940",
      "value": 45128,
      "unit": "players",
      "meta": {
        "peak_in_game": 53596,
        "appid": 1086940
      }
    },
    {
      "rank": 27,
      "id": "1973530",
      "name": "Limbus Company",
      "value": 44957,
      "unit": "players",
      "meta": {
        "peak_in_game": 75318,
        "appid": 1973530
      }
    },
    {
      "rank": 28,
      "id": "322170",
      "name": "Geometry Dash",
      "value": 43987,
      "unit": "players",
      "meta": {
        "peak_in_game": 54778,
        "appid": 322170
      }
    },
    {
      "rank": 29,
      "id": "381210",
      "name": "381210",
      "value": 43858,
      "unit": "players",
      "meta": {
        "peak_in_game": 57813,
        "appid": 381210
      }
    },
    {
      "rank": 30,
      "id": "2507950",
      "name": "2507950",
      "value": 41862,
      "unit": "players",
      "meta": {
        "peak_in_game": 117353,
        "appid": 2507950
      }
    }
  ],
  "source_fetched": [
    {
      "name": "Steam Web API",
      "url": "https://api.steampowered.com/ISteamChartsService/GetGamesByConcurrentPlayers/v1/",
      "fetched_at": "2026-09-26T01:36:39Z",
      "http_status": 200
    }
  ],
  "notes": "steam last_update=1790386460"
}
