{
  "schema_version": "1.0.0",
  "slug": "github-trending-daily",
  "generated_at": "2026-08-11T09:15:33Z",
  "as_of": "2026-08-11T09:15:33Z",
  "period": {
    "label": "daily"
  },
  "metric": {
    "id": "stars_period",
    "unit": "stars"
  },
  "items": [
    {
      "rank": 1,
      "id": "semantica-agi/semantica",
      "name": "semantica-agi/semantica",
      "value": 970.0,
      "unit": "stars",
      "meta": {
        "description": "Graph-Native Infrastructure for Context and Accountable AI Systems",
        "language": "Python",
        "url": "https://github.com/semantica-agi/semantica",
        "total_stars": 4440.0,
        "forks": 497.0,
        "since": "daily"
      }
    },
    {
      "rank": 2,
      "id": "msitarzewski/agency-agents",
      "name": "msitarzewski/agency-agents",
      "value": 1349.0,
      "unit": "stars",
      "meta": {
        "description": "A complete AI agency at your fingertips - From frontend wizards to Reddit community ninjas, from whimsy injectors to reality checkers. Each agent is a specialized expert with personality, processes, and proven deliverables.",
        "language": "Shell",
        "url": "https://github.com/msitarzewski/agency-agents",
        "total_stars": 142113.0,
        "forks": 23166.0,
        "since": "daily"
      }
    },
    {
      "rank": 3,
      "id": "NanmiCoder/MediaCrawler",
      "name": "NanmiCoder/MediaCrawler",
      "value": 259.0,
      "unit": "stars",
      "meta": {
        "description": "小红书笔记 | 评论爬虫、抖音视频 | 评论爬虫、快手视频 | 评论爬虫、B 站视频 ｜ 评论爬虫、微博帖子 ｜ 评论爬虫、百度贴吧帖子 ｜ 百度贴吧评论回复爬虫 | 知乎问答文章｜评论爬虫",
        "language": "Python",
        "url": "https://github.com/NanmiCoder/MediaCrawler",
        "total_stars": 61469.0,
        "forks": 12061.0,
        "since": "daily"
      }
    },
    {
      "rank": 4,
      "id": "addyosmani/agent-skills",
      "name": "addyosmani/agent-skills",
      "value": 659.0,
      "unit": "stars",
      "meta": {
        "description": "Production-grade engineering skills for AI coding agents.",
        "language": "JavaScript",
        "url": "https://github.com/addyosmani/agent-skills",
        "total_stars": 85943.0,
        "forks": 9247.0,
        "since": "daily"
      }
    },
    {
      "rank": 5,
      "id": "paperclipai/paperclip",
      "name": "paperclipai/paperclip",
      "value": 198.0,
      "unit": "stars",
      "meta": {
        "description": "The open-source app everyone uses to manage agents at work",
        "language": "TypeScript",
        "url": "https://github.com/paperclipai/paperclip",
        "total_stars": 76789.0,
        "forks": 14222.0,
        "since": "daily"
      }
    },
    {
      "rank": 6,
      "id": "PrimeIntellect-ai/prime-agent",
      "name": "PrimeIntellect-ai/prime-agent",
      "value": 2642.0,
      "unit": "stars",
      "meta": {
        "description": "A self-improving RLM agent for coding workflows and long-running autonomous tasks.",
        "language": "TypeScript",
        "url": "https://github.com/PrimeIntellect-ai/prime-agent",
        "total_stars": 13446.0,
        "forks": 1374.0,
        "since": "daily"
      }
    },
    {
      "rank": 7,
      "id": "LadybirdBrowser/ladybird",
      "name": "LadybirdBrowser/ladybird",
      "value": 56.0,
      "unit": "stars",
      "meta": {
        "description": "Truly independent web browser",
        "language": "C++",
        "url": "https://github.com/LadybirdBrowser/ladybird",
        "total_stars": 65331.0,
        "forks": 3123.0,
        "since": "daily"
      }
    },
    {
      "rank": 8,
      "id": "ruvnet/RuView",
      "name": "ruvnet/RuView",
      "value": 154.0,
      "unit": "stars",
      "meta": {
        "description": "π RuView turns commodity WiFi signals into real-time spatial intelligence, vital sign monitoring, and presence detection — all without a single pixel of video.",
        "language": "Rust",
        "url": "https://github.com/ruvnet/RuView",
        "total_stars": 89492.0,
        "forks": 11898.0,
        "since": "daily"
      }
    },
    {
      "rank": 9,
      "id": "danielmiessler/LifeOS",
      "name": "danielmiessler/LifeOS",
      "value": 315.0,
      "unit": "stars",
      "meta": {
        "description": "⛰️A General Hill-climbing AI harness that helps you move from Current State to Ideal State in both Life and Work.",
        "language": "TypeScript",
        "url": "https://github.com/danielmiessler/LifeOS",
        "total_stars": 18130.0,
        "forks": 2375.0,
        "since": "daily"
      }
    },
    {
      "rank": 10,
      "id": "firecrawl/firecrawl",
      "name": "firecrawl/firecrawl",
      "value": 835.0,
      "unit": "stars",
      "meta": {
        "description": "The context API to search, scrape, and interact with the web at scale. 🔥",
        "language": "TypeScript",
        "url": "https://github.com/firecrawl/firecrawl",
        "total_stars": 165396.0,
        "forks": 9306.0,
        "since": "daily"
      }
    },
    {
      "rank": 11,
      "id": "TauricResearch/TradingAgents",
      "name": "TauricResearch/TradingAgents",
      "value": 177.0,
      "unit": "stars",
      "meta": {
        "description": "TradingAgents: Multi-Agents LLM Financial Trading Framework",
        "language": "Python",
        "url": "https://github.com/TauricResearch/TradingAgents",
        "total_stars": 97431.0,
        "forks": 18750.0,
        "since": "daily"
      }
    },
    {
      "rank": 12,
      "id": "google-deepmind/weathernext",
      "name": "google-deepmind/weathernext",
      "value": 325.0,
      "unit": "stars",
      "meta": {
        "description": "",
        "language": "Python",
        "url": "https://github.com/google-deepmind/weathernext",
        "total_stars": 7423.0,
        "forks": 958.0,
        "since": "daily"
      }
    },
    {
      "rank": 13,
      "id": "vitali87/code-graph-rag",
      "name": "vitali87/code-graph-rag",
      "value": 682.0,
      "unit": "stars",
      "meta": {
        "description": "The ultimate RAG for your monorepo. Query, understand, and edit multi-language codebases with the power of AI and knowledge graphs",
        "language": "Python",
        "url": "https://github.com/vitali87/code-graph-rag",
        "total_stars": 3637.0,
        "forks": 554.0,
        "since": "daily"
      }
    },
    {
      "rank": 14,
      "id": "pingdotgg/t3code",
      "name": "pingdotgg/t3code",
      "value": 389.0,
      "unit": "stars",
      "meta": {
        "description": "",
        "language": "TypeScript",
        "url": "https://github.com/pingdotgg/t3code",
        "total_stars": 18121.0,
        "forks": 4089.0,
        "since": "daily"
      }
    },
    {
      "rank": 15,
      "id": "Comfy-Org/ComfyUI",
      "name": "Comfy-Org/ComfyUI",
      "value": 922.0,
      "unit": "stars",
      "meta": {
        "description": "The most powerful and modular diffusion model GUI, api and backend with a graph/nodes interface.",
        "language": "Python",
        "url": "https://github.com/Comfy-Org/ComfyUI",
        "total_stars": 126567.0,
        "forks": 14914.0,
        "since": "daily"
      }
    },
    {
      "rank": 16,
      "id": "opa334/Dopamine",
      "name": "opa334/Dopamine",
      "value": 111.0,
      "unit": "stars",
      "meta": {
        "description": "Dopamine is a semi-untethered jailbreak for iOS 15 to 26(.0.1)",
        "language": "C",
        "url": "https://github.com/opa334/Dopamine",
        "total_stars": 6122.0,
        "forks": 6202.0,
        "since": "daily"
      }
    }
  ],
  "source_fetched": [
    {
      "name": "isboyjc/github-trending-api",
      "url": "https://raw.githubusercontent.com/isboyjc/github-trending-api/main/data/daily/all.json",
      "fetched_at": "2026-08-11T09:15:33Z",
      "http_status": 200
    }
  ]
}
