{
  "schema_version": "1.0.0",
  "slug": "box-office-weekend-us",
  "generated_at": "2026-08-24T20:49:55Z",
  "as_of": "2026W34",
  "period": {
    "label": "2026W34"
  },
  "metric": {
    "id": "revenue_usd",
    "unit": "USD"
  },
  "items": [
    {
      "rank": 1,
      "id": "Spider-Man: Brand New Day",
      "name": "Spider-Man: Brand New Day",
      "value": 39000000.0,
      "unit": "USD",
      "meta": {}
    },
    {
      "rank": 2,
      "id": "Insidious: Out of the Further",
      "name": "Insidious: Out of the Further",
      "value": 25300000.0,
      "unit": "USD",
      "meta": {}
    },
    {
      "rank": 3,
      "id": "The Odyssey",
      "name": "The Odyssey",
      "value": 19500000.0,
      "unit": "USD",
      "meta": {}
    },
    {
      "rank": 4,
      "id": "PAW Patrol: The Dino Movie",
      "name": "PAW Patrol: The Dino Movie",
      "value": 9100000.0,
      "unit": "USD",
      "meta": {}
    },
    {
      "rank": 5,
      "id": "The End of Oak Street",
      "name": "The End of Oak Street",
      "value": 9000000.0,
      "unit": "USD",
      "meta": {}
    },
    {
      "rank": 6,
      "id": "Mutiny",
      "name": "Mutiny",
      "value": 7500000.0,
      "unit": "USD",
      "meta": {}
    },
    {
      "rank": 7,
      "id": "Tony",
      "name": "Tony",
      "value": 5011611.0,
      "unit": "USD",
      "meta": {}
    },
    {
      "rank": 8,
      "id": "The Fast and the Furious",
      "name": "The Fast and the Furious",
      "value": 3100000.0,
      "unit": "USD",
      "meta": {}
    },
    {
      "rank": 9,
      "id": "Spa Weekend",
      "name": "Spa Weekend",
      "value": 3034000.0,
      "unit": "USD",
      "meta": {}
    },
    {
      "rank": 10,
      "id": "Teenage Sex and Death at Camp Miasma",
      "name": "Teenage Sex and Death at Camp Miasma",
      "value": 1936918.0,
      "unit": "USD",
      "meta": {}
    },
    {
      "rank": 11,
      "id": "The Magic Faraway Tree",
      "name": "The Magic Faraway Tree",
      "value": 1365791.0,
      "unit": "USD",
      "meta": {}
    },
    {
      "rank": 12,
      "id": "Toy Story 5",
      "name": "Toy Story 5",
      "value": 1040000.0,
      "unit": "USD",
      "meta": {}
    },
    {
      "rank": 13,
      "id": "Minions & Monsters",
      "name": "Minions & Monsters",
      "value": 700000.0,
      "unit": "USD",
      "meta": {}
    },
    {
      "rank": 14,
      "id": "The Brink of War",
      "name": "The Brink of War",
      "value": 663606.0,
      "unit": "USD",
      "meta": {}
    },
    {
      "rank": 15,
      "id": "Moana",
      "name": "Moana",
      "value": 474000.0,
      "unit": "USD",
      "meta": {}
    },
    {
      "rank": 16,
      "id": "Six: The Musical Live!",
      "name": "Six: The Musical Live!",
      "value": 403000.0,
      "unit": "USD",
      "meta": {}
    },
    {
      "rank": 17,
      "id": "One Night Only",
      "name": "One Night Only",
      "value": 300000.0,
      "unit": "USD",
      "meta": {}
    },
    {
      "rank": 18,
      "id": "The Rivals of Amziah King",
      "name": "The Rivals of Amziah King",
      "value": 285000.0,
      "unit": "USD",
      "meta": {}
    },
    {
      "rank": 19,
      "id": "Hot Spot",
      "name": "Hot Spot",
      "value": 250000.0,
      "unit": "USD",
      "meta": {}
    },
    {
      "rank": 20,
      "id": "The Invite",
      "name": "The Invite",
      "value": 198379.0,
      "unit": "USD",
      "meta": {}
    },
    {
      "rank": 21,
      "id": "Super Troopers 3",
      "name": "Super Troopers 3",
      "value": 170000.0,
      "unit": "USD",
      "meta": {}
    },
    {
      "rank": 22,
      "id": "Never Stop Chasing",
      "name": "Never Stop Chasing",
      "value": 164513.0,
      "unit": "USD",
      "meta": {}
    },
    {
      "rank": 23,
      "id": "CatVideoFest 2026",
      "name": "CatVideoFest 2026",
      "value": 79579.0,
      "unit": "USD",
      "meta": {}
    },
    {
      "rank": 24,
      "id": "The Samurai and the Prisoner",
      "name": "The Samurai and the Prisoner",
      "value": 68650.0,
      "unit": "USD",
      "meta": {}
    },
    {
      "rank": 25,
      "id": "It Ends",
      "name": "It Ends",
      "value": 60512.0,
      "unit": "USD",
      "meta": {}
    }
  ],
  "source_fetched": [
    {
      "name": "Box Office Mojo",
      "url": "https://www.boxofficemojo.com/weekend/2026W34/",
      "fetched_at": "2026-08-24T20:49:55Z",
      "http_status": 200
    }
  ]
}
