{
  "schema_version": "1.0.0",
  "slug": "github-trending-daily",
  "generated_at": "2026-10-07T01:34:47Z",
  "as_of": "2026-10-07T01:34:47Z",
  "period": {
    "label": "daily"
  },
  "metric": {
    "id": "stars_period",
    "unit": "stars"
  },
  "items": [
    {
      "rank": 1,
      "id": "tt-a1i/archify",
      "name": "tt-a1i/archify",
      "value": 1002.0,
      "unit": "stars",
      "meta": {
        "description": "Agent skill for beautiful, verifiable architecture, workflow, sequence, data-flow, and lifecycle diagrams—self-contained HTML with motion and crisp export.",
        "language": "HTML",
        "url": "https://github.com/tt-a1i/archify",
        "total_stars": 17010.0,
        "forks": 1184.0,
        "since": "daily"
      }
    },
    {
      "rank": 2,
      "id": "freestylefly/awesome-gpt-image-2",
      "name": "freestylefly/awesome-gpt-image-2",
      "value": 4044.0,
      "unit": "stars",
      "meta": {
        "description": "Prompt as Code | GPT-Image2 工业级提示词引擎与模板库，530+ 个案例逆向工程，20+ 套工业级模板，并提炼出Skills，持续更新中",
        "language": "JavaScript",
        "url": "https://github.com/freestylefly/awesome-gpt-image-2",
        "total_stars": 20686.0,
        "forks": 2087.0,
        "since": "daily"
      }
    },
    {
      "rank": 3,
      "id": "anthropics/claude-plugins-official",
      "name": "anthropics/claude-plugins-official",
      "value": 307.0,
      "unit": "stars",
      "meta": {
        "description": "Official, Anthropic-managed directory of high quality Claude Code Plugins.",
        "language": "Python",
        "url": "https://github.com/anthropics/claude-plugins-official",
        "total_stars": 34254.0,
        "forks": 3881.0,
        "since": "daily"
      }
    },
    {
      "rank": 4,
      "id": "Alishahryar1/free-claude-code",
      "name": "Alishahryar1/free-claude-code",
      "value": 1047.0,
      "unit": "stars",
      "meta": {
        "description": "Use Claude Code, Codex, Pi, and OpenCode for free (1.3B+ free tokens) from your terminal, app, IDE, or phone like OpenClaw (voice supported + ToS friendly)",
        "language": "Python",
        "url": "https://github.com/Alishahryar1/free-claude-code",
        "total_stars": 50128.0,
        "forks": 8130.0,
        "since": "daily"
      }
    },
    {
      "rank": 5,
      "id": "MadsLorentzen/ai-job-search",
      "name": "MadsLorentzen/ai-job-search",
      "value": 1299.0,
      "unit": "stars",
      "meta": {
        "description": "The job search that runs on your machine. AI job application framework built on Claude Code: evaluate postings, tailor CVs, write cover letters, prep interviews. Fork it and own it.",
        "language": "Python",
        "url": "https://github.com/MadsLorentzen/ai-job-search",
        "total_stars": 36063.0,
        "forks": 12303.0,
        "since": "daily"
      }
    },
    {
      "rank": 6,
      "id": "AgriciDaniel/claude-obsidian",
      "name": "AgriciDaniel/claude-obsidian",
      "value": 812.0,
      "unit": "stars",
      "meta": {
        "description": "Self-organizing AI second brain for Obsidian + Claude Code. Drop any source and Claude reads, links, and files it into one connected knowledge graph of plain Markdown you own. AI note-taking, personal knowledge management (PKM), and an open-source Notion alternative. Based on Karpathy's LLM Wiki pattern.",
        "language": "Python",
        "url": "https://github.com/AgriciDaniel/claude-obsidian",
        "total_stars": 13145.0,
        "forks": 1395.0,
        "since": "daily"
      }
    },
    {
      "rank": 7,
      "id": "basecamp/omarchy",
      "name": "basecamp/omarchy",
      "value": 1021.0,
      "unit": "stars",
      "meta": {
        "description": "Beautiful, Modern & Opinionated Linux",
        "language": "Shell",
        "url": "https://github.com/basecamp/omarchy",
        "total_stars": 31746.0,
        "forks": 3223.0,
        "since": "daily"
      }
    },
    {
      "rank": 8,
      "id": "rohitg00/ai-engineering-from-scratch",
      "name": "rohitg00/ai-engineering-from-scratch",
      "value": 837.0,
      "unit": "stars",
      "meta": {
        "description": "Learn it. Build it. Ship it for others.",
        "language": "Python",
        "url": "https://github.com/rohitg00/ai-engineering-from-scratch",
        "total_stars": 49425.0,
        "forks": 8616.0,
        "since": "daily"
      }
    },
    {
      "rank": 9,
      "id": "tinyhumansai/openhuman",
      "name": "tinyhumansai/openhuman",
      "value": 522.0,
      "unit": "stars",
      "meta": {
        "description": "Your Personal AI super intelligence. A brain that builds a local-first memory of your life, a fantastic orchestrator of agent fleets and workflows, and a deep researcher.",
        "language": "Rust",
        "url": "https://github.com/tinyhumansai/openhuman",
        "total_stars": 38054.0,
        "forks": 3747.0,
        "since": "daily"
      }
    },
    {
      "rank": 10,
      "id": "DietrichGebert/ponytail",
      "name": "DietrichGebert/ponytail",
      "value": 1598.0,
      "unit": "stars",
      "meta": {
        "description": "Makes your AI agent think like the laziest senior dev in the room. The best code is the code you never wrote.",
        "language": "JavaScript",
        "url": "https://github.com/DietrichGebert/ponytail",
        "total_stars": 111974.0,
        "forks": 6147.0,
        "since": "daily"
      }
    },
    {
      "rank": 11,
      "id": "anthropics/claude-plugins-community",
      "name": "anthropics/claude-plugins-community",
      "value": 537.0,
      "unit": "stars",
      "meta": {
        "description": "Community plugin marketplace for Claude Cowork and Claude Code. Read-only mirror — submit plugins at clau.de/plugin-directory-submission.",
        "language": "Python",
        "url": "https://github.com/anthropics/claude-plugins-community",
        "total_stars": 2053.0,
        "forks": 186.0,
        "since": "daily"
      }
    },
    {
      "rank": 12,
      "id": "ConardLi/garden-skills",
      "name": "ConardLi/garden-skills",
      "value": 136.0,
      "unit": "stars",
      "meta": {
        "description": "ConardLi's open-source Skills collection, featuring web design, knowledge retrieval, image generation, and more.",
        "language": "CSS",
        "url": "https://github.com/ConardLi/garden-skills",
        "total_stars": 10779.0,
        "forks": 1383.0,
        "since": "daily"
      }
    },
    {
      "rank": 13,
      "id": "browser-use/browser-use",
      "name": "browser-use/browser-use",
      "value": 135.0,
      "unit": "stars",
      "meta": {
        "description": "🌐 Make websites accessible for AI agents. Automate tasks online with ease.",
        "language": "Python",
        "url": "https://github.com/browser-use/browser-use",
        "total_stars": 110654.0,
        "forks": 12174.0,
        "since": "daily"
      }
    },
    {
      "rank": 14,
      "id": "K-Dense-AI/scientific-agent-skills",
      "name": "K-Dense-AI/scientific-agent-skills",
      "value": 130.0,
      "unit": "stars",
      "meta": {
        "description": "Turn any AI agent into an AI Scientist. The #1 Agent Skills library for science, used by 175,000+ scientists worldwide. 163 ready-to-use validated skills plus 100+ scientific databases covering biology, chemistry, medicine, and drug discovery. Compatible with Cursor, Claude Code, Codex, Pi, Antigravity, and the open Agent Skills standard.",
        "language": "Python",
        "url": "https://github.com/K-Dense-AI/scientific-agent-skills",
        "total_stars": 34558.0,
        "forks": 3353.0,
        "since": "daily"
      }
    },
    {
      "rank": 15,
      "id": "marin-community/marin",
      "name": "marin-community/marin",
      "value": 443.0,
      "unit": "stars",
      "meta": {
        "description": "Open-source framework for the research and development of foundation models.",
        "language": "Python",
        "url": "https://github.com/marin-community/marin",
        "total_stars": 2358.0,
        "forks": 208.0,
        "since": "daily"
      }
    },
    {
      "rank": 16,
      "id": "VoltAgent/awesome-agent-skills",
      "name": "VoltAgent/awesome-agent-skills",
      "value": 488.0,
      "unit": "stars",
      "meta": {
        "description": "A curated collection of 1000+ agent skills from official dev teams and the community, compatible with Claude Code, Codex, Gemini CLI, Cursor, and more.",
        "language": "",
        "url": "https://github.com/VoltAgent/awesome-agent-skills",
        "total_stars": 32437.0,
        "forks": 3443.0,
        "since": "daily"
      }
    }
  ],
  "source_fetched": [
    {
      "name": "isboyjc/github-trending-api",
      "url": "https://raw.githubusercontent.com/isboyjc/github-trending-api/main/data/daily/all.json",
      "fetched_at": "2026-10-07T01:34:47Z",
      "http_status": 200
    }
  ]
}
