{
  "schema_version": "1.0.0",
  "slug": "box-office-weekend-us",
  "generated_at": "2026-08-31T13:56:02Z",
  "as_of": "2026W35",
  "period": {
    "label": "2026W35"
  },
  "metric": {
    "id": "revenue_usd",
    "unit": "USD"
  },
  "items": [
    {
      "rank": 1,
      "id": "Spider-Man: Brand New Day",
      "name": "Spider-Man: Brand New Day",
      "value": 15525000.0,
      "unit": "USD",
      "meta": {}
    },
    {
      "rank": 2,
      "id": "The Odyssey",
      "name": "The Odyssey",
      "value": 14300000.0,
      "unit": "USD",
      "meta": {}
    },
    {
      "rank": 3,
      "id": "Coyote vs. Acme",
      "name": "Coyote vs. Acme",
      "value": 11111621.0,
      "unit": "USD",
      "meta": {}
    },
    {
      "rank": 4,
      "id": "The Dog Stars",
      "name": "The Dog Stars",
      "value": 8000000.0,
      "unit": "USD",
      "meta": {}
    },
    {
      "rank": 5,
      "id": "Insidious: Out of the Further",
      "name": "Insidious: Out of the Further",
      "value": 7310000.0,
      "unit": "USD",
      "meta": {}
    },
    {
      "rank": 6,
      "id": "Buddy",
      "name": "Buddy",
      "value": 5363827.0,
      "unit": "USD",
      "meta": {}
    },
    {
      "rank": 7,
      "id": "The End of Oak Street",
      "name": "The End of Oak Street",
      "value": 4950000.0,
      "unit": "USD",
      "meta": {}
    },
    {
      "rank": 8,
      "id": "PAW Patrol: The Dino Movie",
      "name": "PAW Patrol: The Dino Movie",
      "value": 4875000.0,
      "unit": "USD",
      "meta": {}
    },
    {
      "rank": 9,
      "id": "Mutiny",
      "name": "Mutiny",
      "value": 2750000.0,
      "unit": "USD",
      "meta": {}
    },
    {
      "rank": 10,
      "id": "Tony",
      "name": "Tony",
      "value": 2220448.0,
      "unit": "USD",
      "meta": {}
    },
    {
      "rank": 11,
      "id": "Ghost: 2 Big to Rig",
      "name": "Ghost: 2 Big to Rig",
      "value": 1611776.0,
      "unit": "USD",
      "meta": {}
    },
    {
      "rank": 12,
      "id": "Spa Weekend",
      "name": "Spa Weekend",
      "value": 1184100.0,
      "unit": "USD",
      "meta": {}
    },
    {
      "rank": 13,
      "id": "It Ends",
      "name": "It Ends",
      "value": 724304.0,
      "unit": "USD",
      "meta": {}
    },
    {
      "rank": 14,
      "id": "Teenage Sex and Death at Camp Miasma",
      "name": "Teenage Sex and Death at Camp Miasma",
      "value": 707863.0,
      "unit": "USD",
      "meta": {}
    },
    {
      "rank": 15,
      "id": "Idiots",
      "name": "Idiots",
      "value": 700000.0,
      "unit": "USD",
      "meta": {}
    },
    {
      "rank": 16,
      "id": "Finding Emily",
      "name": "Finding Emily",
      "value": 680000.0,
      "unit": "USD",
      "meta": {}
    },
    {
      "rank": 17,
      "id": "Toxic",
      "name": "Toxic",
      "value": 480000.0,
      "unit": "USD",
      "meta": {}
    },
    {
      "rank": 18,
      "id": "Toy Story 5",
      "name": "Toy Story 5",
      "value": 422000.0,
      "unit": "USD",
      "meta": {}
    },
    {
      "rank": 19,
      "id": "Minions & Monsters",
      "name": "Minions & Monsters",
      "value": 339000.0,
      "unit": "USD",
      "meta": {}
    },
    {
      "rank": 20,
      "id": "The Magic Faraway Tree",
      "name": "The Magic Faraway Tree",
      "value": 285452.0,
      "unit": "USD",
      "meta": {}
    },
    {
      "rank": 21,
      "id": "The Fast and the Furious",
      "name": "The Fast and the Furious",
      "value": 250000.0,
      "unit": "USD",
      "meta": {}
    },
    {
      "rank": 22,
      "id": "Moana",
      "name": "Moana",
      "value": 170000.0,
      "unit": "USD",
      "meta": {}
    },
    {
      "rank": 23,
      "id": "The Invite",
      "name": "The Invite",
      "value": 112344.0,
      "unit": "USD",
      "meta": {}
    },
    {
      "rank": 24,
      "id": "American Doctor",
      "name": "American Doctor",
      "value": 110103.0,
      "unit": "USD",
      "meta": {}
    },
    {
      "rank": 25,
      "id": "The Brink of War",
      "name": "The Brink of War",
      "value": 90220.0,
      "unit": "USD",
      "meta": {}
    }
  ],
  "source_fetched": [
    {
      "name": "Box Office Mojo",
      "url": "https://www.boxofficemojo.com/weekend/2026W35/",
      "fetched_at": "2026-08-31T13:56:02Z",
      "http_status": 200
    }
  ]
}
