{
  "schema_version": "1.0.0",
  "slug": "soccer-pl-table",
  "generated_at": "2026-10-16T01:23:50Z",
  "as_of": "2026-10-16T01:23:50Z",
  "period": {
    "label": "2026-27 English Premier League"
  },
  "metric": {
    "id": "points",
    "unit": "pts"
  },
  "items": [
    {
      "rank": 1,
      "id": "382",
      "name": "Manchester City",
      "value": 18.0,
      "unit": "pts",
      "meta": {
        "group": "2026-27 English Premier League",
        "wins": 6.0,
        "losses": 0.0,
        "ties": 0.0,
        "games_played": 6.0,
        "goal_diff": 11.0,
        "season": "2026-27 English Premier League"
      }
    },
    {
      "rank": 2,
      "id": "359",
      "name": "Arsenal",
      "value": 15.0,
      "unit": "pts",
      "meta": {
        "group": "2026-27 English Premier League",
        "wins": 5.0,
        "losses": 1.0,
        "ties": 0.0,
        "games_played": 6.0,
        "goal_diff": 5.0,
        "season": "2026-27 English Premier League"
      }
    },
    {
      "rank": 3,
      "id": "331",
      "name": "Brighton & Hove Albion",
      "value": 13.0,
      "unit": "pts",
      "meta": {
        "group": "2026-27 English Premier League",
        "wins": 4.0,
        "losses": 1.0,
        "ties": 1.0,
        "games_played": 6.0,
        "goal_diff": 13.0,
        "season": "2026-27 English Premier League"
      }
    },
    {
      "rank": 4,
      "id": "337",
      "name": "Brentford",
      "value": 10.0,
      "unit": "pts",
      "meta": {
        "group": "2026-27 English Premier League",
        "wins": 2.0,
        "losses": 0.0,
        "ties": 4.0,
        "games_played": 6.0,
        "goal_diff": 6.0,
        "season": "2026-27 English Premier League"
      }
    },
    {
      "rank": 5,
      "id": "368",
      "name": "Everton",
      "value": 10.0,
      "unit": "pts",
      "meta": {
        "group": "2026-27 English Premier League",
        "wins": 2.0,
        "losses": 0.0,
        "ties": 4.0,
        "games_played": 6.0,
        "goal_diff": 3.0,
        "season": "2026-27 English Premier League"
      }
    },
    {
      "rank": 6,
      "id": "363",
      "name": "Chelsea",
      "value": 10.0,
      "unit": "pts",
      "meta": {
        "group": "2026-27 English Premier League",
        "wins": 3.0,
        "losses": 2.0,
        "ties": 1.0,
        "games_played": 6.0,
        "goal_diff": 2.0,
        "season": "2026-27 English Premier League"
      }
    },
    {
      "rank": 7,
      "id": "357",
      "name": "Leeds United",
      "value": 9.0,
      "unit": "pts",
      "meta": {
        "group": "2026-27 English Premier League",
        "wins": 2.0,
        "losses": 1.0,
        "ties": 3.0,
        "games_played": 6.0,
        "goal_diff": 3.0,
        "season": "2026-27 English Premier League"
      }
    },
    {
      "rank": 8,
      "id": "306",
      "name": "Hull City",
      "value": 9.0,
      "unit": "pts",
      "meta": {
        "group": "2026-27 English Premier League",
        "wins": 2.0,
        "losses": 1.0,
        "ties": 3.0,
        "games_played": 6.0,
        "goal_diff": 2.0,
        "season": "2026-27 English Premier League"
      }
    },
    {
      "rank": 9,
      "id": "364",
      "name": "Liverpool",
      "value": 9.0,
      "unit": "pts",
      "meta": {
        "group": "2026-27 English Premier League",
        "wins": 2.0,
        "losses": 1.0,
        "ties": 3.0,
        "games_played": 6.0,
        "goal_diff": 0.0,
        "season": "2026-27 English Premier League"
      }
    },
    {
      "rank": 10,
      "id": "373",
      "name": "Ipswich Town",
      "value": 9.0,
      "unit": "pts",
      "meta": {
        "group": "2026-27 English Premier League",
        "wins": 3.0,
        "losses": 3.0,
        "ties": 0.0,
        "games_played": 6.0,
        "goal_diff": -3.0,
        "season": "2026-27 English Premier League"
      }
    },
    {
      "rank": 11,
      "id": "361",
      "name": "Newcastle United",
      "value": 8.0,
      "unit": "pts",
      "meta": {
        "group": "2026-27 English Premier League",
        "wins": 2.0,
        "losses": 2.0,
        "ties": 2.0,
        "games_played": 6.0,
        "goal_diff": -3.0,
        "season": "2026-27 English Premier League"
      }
    },
    {
      "rank": 12,
      "id": "384",
      "name": "Crystal Palace",
      "value": 7.0,
      "unit": "pts",
      "meta": {
        "group": "2026-27 English Premier League",
        "wins": 2.0,
        "losses": 3.0,
        "ties": 1.0,
        "games_played": 6.0,
        "goal_diff": -3.0,
        "season": "2026-27 English Premier League"
      }
    },
    {
      "rank": 13,
      "id": "360",
      "name": "Manchester United",
      "value": 6.0,
      "unit": "pts",
      "meta": {
        "group": "2026-27 English Premier League",
        "wins": 1.0,
        "losses": 2.0,
        "ties": 3.0,
        "games_played": 6.0,
        "goal_diff": 0.0,
        "season": "2026-27 English Premier League"
      }
    },
    {
      "rank": 14,
      "id": "388",
      "name": "Coventry City",
      "value": 6.0,
      "unit": "pts",
      "meta": {
        "group": "2026-27 English Premier League",
        "wins": 2.0,
        "losses": 4.0,
        "ties": 0.0,
        "games_played": 6.0,
        "goal_diff": -6.0,
        "season": "2026-27 English Premier League"
      }
    },
    {
      "rank": 15,
      "id": "393",
      "name": "Nottingham Forest",
      "value": 5.0,
      "unit": "pts",
      "meta": {
        "group": "2026-27 English Premier League",
        "wins": 1.0,
        "losses": 3.0,
        "ties": 2.0,
        "games_played": 6.0,
        "goal_diff": -3.0,
        "season": "2026-27 English Premier League"
      }
    },
    {
      "rank": 16,
      "id": "362",
      "name": "Aston Villa",
      "value": 5.0,
      "unit": "pts",
      "meta": {
        "group": "2026-27 English Premier League",
        "wins": 1.0,
        "losses": 3.0,
        "ties": 2.0,
        "games_played": 6.0,
        "goal_diff": -5.0,
        "season": "2026-27 English Premier League"
      }
    },
    {
      "rank": 17,
      "id": "366",
      "name": "Sunderland",
      "value": 4.0,
      "unit": "pts",
      "meta": {
        "group": "2026-27 English Premier League",
        "wins": 1.0,
        "losses": 4.0,
        "ties": 1.0,
        "games_played": 6.0,
        "goal_diff": -6.0,
        "season": "2026-27 English Premier League"
      }
    },
    {
      "rank": 18,
      "id": "349",
      "name": "AFC Bournemouth",
      "value": 3.0,
      "unit": "pts",
      "meta": {
        "group": "2026-27 English Premier League",
        "wins": 0.0,
        "losses": 3.0,
        "ties": 3.0,
        "games_played": 6.0,
        "goal_diff": -6.0,
        "season": "2026-27 English Premier League"
      }
    },
    {
      "rank": 19,
      "id": "367",
      "name": "Tottenham Hotspur",
      "value": 3.0,
      "unit": "pts",
      "meta": {
        "group": "2026-27 English Premier League",
        "wins": 0.0,
        "losses": 3.0,
        "ties": 3.0,
        "games_played": 6.0,
        "goal_diff": -6.0,
        "season": "2026-27 English Premier League"
      }
    },
    {
      "rank": 20,
      "id": "370",
      "name": "Fulham",
      "value": 2.0,
      "unit": "pts",
      "meta": {
        "group": "2026-27 English Premier League",
        "wins": 0.0,
        "losses": 4.0,
        "ties": 2.0,
        "games_played": 6.0,
        "goal_diff": -4.0,
        "season": "2026-27 English Premier League"
      }
    }
  ],
  "source_fetched": [
    {
      "name": "ESPN",
      "url": "https://site.web.api.espn.com/apis/v2/sports/soccer/eng.1/standings",
      "fetched_at": "2026-10-16T01:23:50Z",
      "http_status": 200
    }
  ]
}
