{
  "schema_version": "1.0.0",
  "slug": "github-trending-weekly",
  "generated_at": "2026-10-26T06:20:43Z",
  "as_of": "2026-10-26T06:20:43Z",
  "period": {
    "label": "weekly"
  },
  "metric": {
    "id": "stars_period",
    "unit": "stars"
  },
  "items": [
    {
      "rank": 1,
      "id": "anthropics/claude-plugins-community",
      "name": "anthropics/claude-plugins-community",
      "value": 1199.0,
      "unit": "stars",
      "meta": {
        "description": "Community plugin marketplace for Claude Cowork and Claude Code. Read-only mirror — submit plugins at clau.de/plugin-directory-submission.",
        "language": "Python",
        "url": "https://github.com/anthropics/claude-plugins-community",
        "total_stars": 2053.0,
        "forks": 186.0,
        "since": "weekly"
      }
    },
    {
      "rank": 2,
      "id": "AprilNEA/OpenLogi",
      "name": "AprilNEA/OpenLogi",
      "value": 7648.0,
      "unit": "stars",
      "meta": {
        "description": "⚡️A native, local-first alternative to Logitech Options+, written in Rust 🦀 — remap buttons, DPI, and SmartShift over HID++. No account, no telemetry.",
        "language": "Rust",
        "url": "https://github.com/AprilNEA/OpenLogi",
        "total_stars": 16718.0,
        "forks": 467.0,
        "since": "weekly"
      }
    },
    {
      "rank": 3,
      "id": "modular/modular",
      "name": "modular/modular",
      "value": 2354.0,
      "unit": "stars",
      "meta": {
        "description": "The Modular Platform (includes MAX & Mojo)",
        "language": "Mojo",
        "url": "https://github.com/modular/modular",
        "total_stars": 29200.0,
        "forks": 3107.0,
        "since": "weekly"
      }
    },
    {
      "rank": 4,
      "id": "basecamp/omarchy",
      "name": "basecamp/omarchy",
      "value": 4601.0,
      "unit": "stars",
      "meta": {
        "description": "Beautiful, Modern & Opinionated Linux",
        "language": "Shell",
        "url": "https://github.com/basecamp/omarchy",
        "total_stars": 31746.0,
        "forks": 3223.0,
        "since": "weekly"
      }
    },
    {
      "rank": 5,
      "id": "freestylefly/awesome-gpt-image-2",
      "name": "freestylefly/awesome-gpt-image-2",
      "value": 5329.0,
      "unit": "stars",
      "meta": {
        "description": "Prompt as Code | GPT-Image2 工业级提示词引擎与模板库，530+ 个案例逆向工程，20+ 套工业级模板，并提炼出Skills，持续更新中",
        "language": "JavaScript",
        "url": "https://github.com/freestylefly/awesome-gpt-image-2",
        "total_stars": 20686.0,
        "forks": 2087.0,
        "since": "weekly"
      }
    },
    {
      "rank": 6,
      "id": "apache/maka",
      "name": "apache/maka",
      "value": 1769.0,
      "unit": "stars",
      "meta": {
        "description": "Apache Maka (Incubating) is a local-first AI agent workspace. Model messages, tool calls, tool results, permission decisions, and termination events are recorded as an append-only log.",
        "language": "TypeScript",
        "url": "https://github.com/apache/maka",
        "total_stars": 3554.0,
        "forks": 346.0,
        "since": "weekly"
      }
    },
    {
      "rank": 7,
      "id": "openai/codex",
      "name": "openai/codex",
      "value": 11424.0,
      "unit": "stars",
      "meta": {
        "description": "Lightweight coding agent that runs in your terminal",
        "language": "Rust",
        "url": "https://github.com/openai/codex",
        "total_stars": 118654.0,
        "forks": 18083.0,
        "since": "weekly"
      }
    },
    {
      "rank": 8,
      "id": "harry0703/MoneyPrinterTurbo",
      "name": "harry0703/MoneyPrinterTurbo",
      "value": 9019.0,
      "unit": "stars",
      "meta": {
        "description": "利用 AI 大模型和自动化工作流，根据主题或关键词一键生成高清短视频。Generate HD short videos from a topic or keyword with an automated AI workflow.",
        "language": "Python",
        "url": "https://github.com/harry0703/MoneyPrinterTurbo",
        "total_stars": 116769.0,
        "forks": 17759.0,
        "since": "weekly"
      }
    },
    {
      "rank": 9,
      "id": "chaitanyagiri/munder-difflin",
      "name": "chaitanyagiri/munder-difflin",
      "value": 2487.0,
      "unit": "stars",
      "meta": {
        "description": "local multi-agent harness",
        "language": "JavaScript",
        "url": "https://github.com/chaitanyagiri/munder-difflin",
        "total_stars": 4667.0,
        "forks": 570.0,
        "since": "weekly"
      }
    },
    {
      "rank": 10,
      "id": "cursor/plugins",
      "name": "cursor/plugins",
      "value": 2045.0,
      "unit": "stars",
      "meta": {
        "description": "Cursor plugin specification and official plugins",
        "language": "TypeScript",
        "url": "https://github.com/cursor/plugins",
        "total_stars": 5308.0,
        "forks": 434.0,
        "since": "weekly"
      }
    },
    {
      "rank": 11,
      "id": "volcengine/OpenViking",
      "name": "volcengine/OpenViking",
      "value": 4211.0,
      "unit": "stars",
      "meta": {
        "description": "Self-evolving Context Database for AI Agents. Unify Agent Memory, Knowledge RAG and Skills.",
        "language": "Python",
        "url": "https://github.com/volcengine/OpenViking",
        "total_stars": 33481.0,
        "forks": 2549.0,
        "since": "weekly"
      }
    },
    {
      "rank": 12,
      "id": "akitaonrails/ai-memory",
      "name": "akitaonrails/ai-memory",
      "value": 2073.0,
      "unit": "stars",
      "meta": {
        "description": "Solution for long term memory for agent coding CLIs and to facilitate handoff between different agent vendors",
        "language": "Rust",
        "url": "https://github.com/akitaonrails/ai-memory",
        "total_stars": 4777.0,
        "forks": 341.0,
        "since": "weekly"
      }
    },
    {
      "rank": 13,
      "id": "public-apis/public-apis",
      "name": "public-apis/public-apis",
      "value": 6747.0,
      "unit": "stars",
      "meta": {
        "description": "A collective list of free APIs",
        "language": "Python",
        "url": "https://github.com/public-apis/public-apis",
        "total_stars": 470797.0,
        "forks": 51916.0,
        "since": "weekly"
      }
    },
    {
      "rank": 14,
      "id": "PostHog/posthog",
      "name": "PostHog/posthog",
      "value": 1426.0,
      "unit": "stars",
      "meta": {
        "description": "🦔 PostHog is the leading platform for building self-driving products. Our developer tools – AI observability, analytics, session replay, flags, experiments, error tracking, logs, and more – capture all the context agents need to diagnose problems, uncover opportunities, and ship fixes. Steer it all from Slack, web, desktop, or the MCP.",
        "language": "Python",
        "url": "https://github.com/PostHog/posthog",
        "total_stars": 39214.0,
        "forks": 3289.0,
        "since": "weekly"
      }
    },
    {
      "rank": 15,
      "id": "tashfeenahmed/freellmapi",
      "name": "tashfeenahmed/freellmapi",
      "value": 1441.0,
      "unit": "stars",
      "meta": {
        "description": "7.4 billion tokens per month. 34 free LLM providers. 635 free model endpoints. All behind one /v1 endpoint, plus any custom OpenAI-compatible endpoint. Smart routing, automatic failover, encrypted keys. Personal experimentation only.",
        "language": "TypeScript",
        "url": "https://github.com/tashfeenahmed/freellmapi",
        "total_stars": 20501.0,
        "forks": 2951.0,
        "since": "weekly"
      }
    },
    {
      "rank": 16,
      "id": "bookorbit/bookorbit",
      "name": "bookorbit/bookorbit",
      "value": 869.0,
      "unit": "stars",
      "meta": {
        "description": "BookOrbit: Your Reading Space",
        "language": "TypeScript",
        "url": "https://github.com/bookorbit/bookorbit",
        "total_stars": 3215.0,
        "forks": 202.0,
        "since": "weekly"
      }
    }
  ],
  "source_fetched": [
    {
      "name": "isboyjc/github-trending-api",
      "url": "https://raw.githubusercontent.com/isboyjc/github-trending-api/main/data/weekly/all.json",
      "fetched_at": "2026-10-26T06:20:43Z",
      "http_status": 200
    }
  ]
}
